{
  "id": "2026-spy-family-s02",
  "media_id": "spy-family",
  "year": 2026,
  "unit": {
    "type": "season",
    "season_number": 2
  },
  "watch_status": "planned",
  "started_at": null,
  "finished_at": null,
  "platform": "Crunchyroll",
  "rewatch": false,
  "rating": null,
  "favorite": false,
  "notes": "Dado demonstrativo para status pessoal planned."
}
