{
  "id": "2026-boots-s01",
  "media_id": "boots",
  "year": 2026,
  "unit": {
    "type": "season",
    "season_number": 1
  },
  "watch_status": "dropped",
  "started_at": "2026-02-04",
  "finished_at": null,
  "platform": null,
  "rewatch": false,
  "rating": null,
  "favorite": false,
  "notes": "Dado demonstrativo para status pessoal dropped com obra cancelada."
}
