{
  "id": "2026-typhoon-family",
  "media_id": "typhoon-family",
  "year": 2026,
  "unit": {
    "type": "limited_season"
  },
  "watch_status": "paused",
  "started_at": "2026-03-18",
  "finished_at": null,
  "platform": "Netflix",
  "rewatch": false,
  "rating": null,
  "favorite": false,
  "notes": "Dado demonstrativo para K-drama em limited_season pausado."
}
